<?xml version="1.0" encoding="UTF-8"?>
<!--

    Copyright (c) 2010-2012, University of Sussex
    All rights reserved.

    Redistribution and use in source and binary forms, with or without
    modification, are permitted provided that the following conditions are met:

     * Redistributions of source code must retain the above copyright notice,
       this list of conditions and the following disclaimer.

     * Redistributions in binary form must reproduce the above copyright notice,
       this list of conditions and the following disclaimer in the documentation
       and/or other materials provided with the distribution.

     * Neither the name of the University of Sussex nor the names of its
       contributors may be used to endorse or promote products derived from this
       software without specific prior written permission.

    THIS SOFTWARE IS PROVIDED BY THE COPYRIGHT HOLDERS AND CONTRIBUTORS "AS IS"
    AND ANY EXPRESS OR IMPLIED WARRANTIES, INCLUDING, BUT NOT LIMITED TO, THE
    IMPLIED WARRANTIES OF MERCHANTABILITY AND FITNESS FOR A PARTICULAR PURPOSE
    ARE DISCLAIMED. IN NO EVENT SHALL THE COPYRIGHT HOLDER OR CONTRIBUTORS BE
    LIABLE FOR ANY DIRECT, INDIRECT, INCIDENTAL, SPECIAL, EXEMPLARY, OR
    CONSEQUENTIAL DAMAGES (INCLUDING, BUT NOT LIMITED TO, PROCUREMENT OF
    SUBSTITUTE GOODS OR SERVICES; LOSS OF USE, DATA, OR PROFITS; OR BUSINESS
    INTERRUPTION) HOWEVER CAUSED AND ON ANY THEORY OF LIABILITY, WHETHER IN
    CONTRACT, STRICT LIABILITY, OR TORT (INCLUDING NEGLIGENCE OR OTHERWISE)
    ARISING IN ANY WAY OUT OF THE USE OF THIS SOFTWARE, EVEN IF ADVISED OF THE
    POSSIBILITY OF SUCH DAMAGE.

-->
<configuration xmlns="http://byblo.org"
               xmlns:xsi="http://www.w3.org/2001/XMLSchema-instance"
               xsi:schemaLocation="http://byblo.org defaults.xsd">

    <measure>lin</measure>
    <charset>UTF-8</charset>
    <locale>en-GB</locale>

    <fileFormats>

        <fileFormat>
            <name>instances</name>
            <skipIndex>
                <column>false</column>
                <column>false</column>
            </skipIndex>
            <compact>true</compact>
        </fileFormat>

        <fileFormat>
            <name>entries</name>
            <skipIndex>
                <column>true</column>
            </skipIndex>
        </fileFormat>

        <fileFormat>
            <name>features</name>
            <skipIndex>
                <column>true</column>
            </skipIndex>
        </fileFormat>

        <fileFormat>
            <name>events</name>
            <skipIndex>
                <column>true</column>
                <column>true</column>
            </skipIndex>
            <compact>true</compact>
        </fileFormat>

        <fileFormat>
            <name>sims</name>
            <skipIndex>
                <column>false</column>
                <column>false</column>
            </skipIndex>
            <compact>true</compact>
        </fileFormat>

        <fileFormat>
            <name>neighbours</name>
            <skipIndex>
                <column>false</column>
                <column>false</column>
            </skipIndex>
            <compact>true</compact>
        </fileFormat>

    </fileFormats>


    <measures>

        <measure>
            <name>confusion</name>
            <description>Confusion Probability</description>
            <aliases>
                <alias>confusion</alias>
                <alias>conf</alias>
            </aliases>
            <class>uk.ac.susx.mlcl.byblo.measures.impl.Confusion</class>
        </measure>

        <measure>
            <name>cosine</name>
            <description>Consine Similarity</description>
            <aliases>
                <alias>cosine</alias>
                <alias>cos</alias>
                <alias>pearson</alias>
                <alias>product-moment</alias>
            </aliases>
            <class>uk.ac.susx.mlcl.byblo.measures.impl.Cosine</class>
        </measure>

        <measure>
            <name>dice</name>
            <description>Dice's Co-efficient</description>
            <aliases>
                <alias>dice</alias>
            </aliases>
            <class>uk.ac.susx.mlcl.byblo.measures.impl.Dice</class>
        </measure>

        <measure>
            <name>dotproduct</name>
            <description>Inner-Product: Proximity measure calculating
                similarity as the dot product of the vectors. For unit vectors
                this is equivalent to Cosine.
            </description>
            <aliases>
                <alias>dot_product</alias>
                <alias>inner_product</alias>
                <alias>dp</alias>
            </aliases>
            <class>uk.ac.susx.mlcl.byblo.measures.impl.DotProduct</class>
        </measure>

        <measure>
            <name>hindle</name>
            <description>Hindle</description>
            <aliases>
                <alias>hindle</alias>
            </aliases>
            <class>uk.ac.susx.mlcl.byblo.measures.impl.Hindle</class>
        </measure>


        <measure>
            <name>jaccard</name>
            <description>Jaccard Index</description>
            <aliases>
                <alias>jaccard</alias>
                <alias>jacc</alias>
                <alias>j</alias>
            </aliases>
            <class>uk.ac.susx.mlcl.byblo.measures.impl.Jaccard</class>
        </measure>

        <measure>
            <name>js</name>
            <description>Jensen-Shannon Divergence</description>
            <aliases>
                <alias>jenson</alias>
                <alias>js</alias>
                <alias>jensen</alias>
                <alias>jensen-shannon</alias>
                <alias>jenson-shannon</alias>
            </aliases>
            <class>uk.ac.susx.mlcl.byblo.measures.impl.JensenShannonDivergence</class>
        </measure>

        <measure>
            <name>kendaltau</name>
            <description>Kendall's Tau Rank Correlation Coefficient</description>
            <aliases>
                <alias>kendall</alias>
                <alias>tau</alias>
                <alias>kendaltau</alias>
                <alias>kendalstau</alias>
            </aliases>
            <class>uk.ac.susx.mlcl.byblo.measures.impl.KendallsTau</class>
        </measure>

        <measure>
            <name>kl</name>
            <description>Kullbackâ€“Leibler Divergence</description>
            <aliases>
                <alias>kl-divergence</alias>
                <alias>kld</alias>
                <alias>kl</alias>
                <alias>kullback</alias>
                <alias>leibler</alias>
            </aliases>
            <class>uk.ac.susx.mlcl.byblo.measures.impl.KullbackLeiblerDivergence</class>
        </measure>


        <measure>
            <name>lambda</name>
            <description>Lambda Divergence</description>
            <aliases>
                <alias>lambda-divergence</alias>
                <alias>lambda</alias>
                <alias>ld</alias>
            </aliases>
            <class>uk.ac.susx.mlcl.byblo.measures.impl.LambdaDivergence</class>
            <parameters>
                <parameter>
                    <name>lambda</name>
                    <type>double</type>
                    <defaultValue>0.5</defaultValue>
                    <required>false</required>
                </parameter>
            </parameters>
        </measure>


        <measure>
            <name>lin</name>
            <description>Lin</description>
            <aliases>
                <alias>lin</alias>
                <alias>lin98</alias>
            </aliases>
            <class>uk.ac.susx.mlcl.byblo.measures.impl.Lin</class>

        </measure>

        <measure>
            <name>lee</name>
            <description>Lee Alpha-Skew Divergence</description>
            <aliases>
                <alias>lee</alias>
                <alias>alpha-skew</alias>
                <alias>alphaskew</alias>
                <alias>skew_divergence</alias>
            </aliases>
            <class>uk.ac.susx.mlcl.byblo.measures.impl.LeeSkewDivergence</class>
            <parameters>
                <parameter>
                    <name>alpha</name>
                    <type>double</type>
                    <defaultValue>0.99</defaultValue>
                    <required>false</required>
                </parameter>
            </parameters>
        </measure>

        <measure>
            <name>lp</name>
            <description>Lp-Space Distance</description>
            <aliases>
                <alias>lp</alias>
                <alias>lpspace</alias>
                <alias>minkowski</alias>
            </aliases>
            <class>uk.ac.susx.mlcl.byblo.measures.impl.LpSpaceDistance</class>
            <parameters>
                <parameter>
                    <name>power</name>
                    <type>double</type>
                    <defaultValue>2</defaultValue>
                    <required>false</required>
                </parameter>
            </parameters>
        </measure>

        <measure>
            <name>overlap</name>
            <description>Overlap</description>
            <aliases>
                <alias>overlap</alias>
            </aliases>
            <class>uk.ac.susx.mlcl.byblo.measures.impl.Overlap</class>
        </measure>

        <measure>
            <name>precision</name>
            <description>Precision</description>
            <aliases>
                <alias>precision</alias>
                <alias>prec</alias>
                <alias>prc</alias>
                <alias>p</alias>
            </aliases>
            <class>uk.ac.susx.mlcl.byblo.measures.impl.Precision</class>
        </measure>

        <measure>
            <name>recall</name>
            <description>Recall</description>
            <aliases>
                <alias>recall</alias>
                <alias>rcl</alias>
                <alias>rec</alias>